{
 "schema_version": "1.0",
 "benchmark_id": "PS-0021",
 "hardware_ref": "gpu-box-01",
 "protocol": "reasoning-v1",
 "model": {
  "model_name": "Step3.7-Flash",
  "model_family": "Step 3 (StepFun)",
  "parameter_count": null,
  "active_parameter_count": null,
  "quantization": null,
  "quantization_format": "GGUF",
  "model_file_size_gb": null
 },
 "hardware": {
  "gpu_name": "NVIDIA GeForce RTX 3060",
  "gpu_vendor": "NVIDIA",
  "gpu_architecture": "Ampere",
  "gpu_vram_gb": 12,
  "gpu_count": 2,
  "cpu_name": "Intel Xeon E5-1650 v4",
  "cpu_cores": 6,
  "cpu_threads": 12,
  "system_ram_gb": 128,
  "system_ram_speed_mhz": null,
  "storage_type": "NVMe SSD",
  "operating_system": "Ubuntu 26.04 LTS"
 },
 "software": {
  "inference_backend": "Ollama",
  "backend_version": "0.32.8",
  "runtime": "CUDA",
  "driver_version": "610.43.02"
 },
 "configuration": {
  "context_size": null,
  "offloading_strategy": "multi-gpu-spill"
 },
 "performance": {
  "generation_tokens_per_second": 5.82,
  "generation_tps_mean": 5.66,
  "generation_tps_max": 6.69,
  "time_to_first_token_seconds": null,
  "total_generated_tokens": 5691,
  "total_runtime_seconds": 922.8
 },
 "tests": {
  "attempted": 9,
  "completed": 9
 },
 "ps_points": 108.2,
 "result_classification": "usable",
 "reproducibility": {
  "timestamp": "2026-08-09T17:08:01Z",
  "operator": "mw00",
  "notes": "reasoning-v1 suite on system 'uranus'. Quantization not recorded at run time."
 }
}