{
 "schema_version": "1.0",
 "benchmark_id": "PS-0009",
 "hardware_ref": "gpu-box-01",
 "protocol": "reasoning-v1",
 "model": {
  "model_name": "Qwen3.8-27B",
  "model_family": "Qwen3.8",
  "parameter_count": 27000000000.0,
  "active_parameter_count": 27000000000.0,
  "quantization": null,
  "quantization_format": "GGUF",
  "model_file_size_gb": 18.0
 },
 "hardware": {
  "gpu_name": "NVIDIA GeForce RTX 3060",
  "gpu_vendor": "NVIDIA",
  "gpu_architecture": "Ampere",
  "gpu_vram_gb": 12,
  "gpu_count": 2,
  "cpu_name": "Intel Xeon E5-1650 v4",
  "cpu_cores": 6,
  "cpu_threads": 12,
  "system_ram_gb": 128,
  "system_ram_speed_mhz": null,
  "storage_type": "NVMe SSD",
  "operating_system": "Ubuntu 26.04 LTS"
 },
 "software": {
  "inference_backend": "Ollama",
  "backend_version": "0.32.8",
  "runtime": "CUDA",
  "driver_version": "610.43.02"
 },
 "configuration": {
  "context_size": null,
  "offloading_strategy": "multi-gpu-spill"
 },
 "performance": {
  "generation_tokens_per_second": 16.15,
  "generation_tps_mean": 16.23,
  "generation_tps_max": 16.84,
  "time_to_first_token_seconds": null,
  "total_generated_tokens": 7994,
  "total_runtime_seconds": 482.4
 },
 "tests": {
  "attempted": 11,
  "completed": 11
 },
 "ps_points": 211.5,
 "result_classification": "excellent",
 "reproducibility": {
  "timestamp": "2026-08-09T18:17:36Z",
  "operator": "mw00",
  "notes": "reasoning-v1 suite on system 'uranus'."
 }
}