{
 "schema_version": "1.0",
 "benchmark_id": "PS-0019",
 "hardware_ref": "gpu-box-01",
 "protocol": "reasoning-v1",
 "model": {
  "model_name": "Qwen3.5-122B-A10B-MTP",
  "model_family": "Qwen3.5",
  "parameter_count": 122000000000.0,
  "active_parameter_count": 10000000000.0,
  "quantization": "UD-IQ3_XXS",
  "quantization_format": "GGUF",
  "model_file_size_gb": null
 },
 "hardware": {
  "gpu_name": "NVIDIA GeForce RTX 3060",
  "gpu_vendor": "NVIDIA",
  "gpu_architecture": "Ampere",
  "gpu_vram_gb": 12,
  "gpu_count": 2,
  "cpu_name": "Intel Xeon E5-1650 v4",
  "cpu_cores": 6,
  "cpu_threads": 12,
  "system_ram_gb": 128,
  "system_ram_speed_mhz": null,
  "storage_type": "NVMe SSD",
  "operating_system": "Ubuntu 26.04 LTS"
 },
 "software": {
  "inference_backend": "Ollama",
  "backend_version": "0.32.8",
  "runtime": "CUDA",
  "driver_version": "610.43.02"
 },
 "configuration": {
  "context_size": null,
  "offloading_strategy": "multi-gpu-spill"
 },
 "performance": {
  "generation_tokens_per_second": 8.12,
  "generation_tps_mean": 8.02,
  "generation_tps_max": 8.32,
  "time_to_first_token_seconds": null,
  "total_generated_tokens": 10487,
  "total_runtime_seconds": 1280.9
 },
 "tests": {
  "attempted": 11,
  "completed": 11
 },
 "ps_points": 131.2,
 "result_classification": "good",
 "reproducibility": {
  "timestamp": "2026-08-09T19:15:12Z",
  "operator": "mw00",
  "notes": "reasoning-v1 suite on system 'uranus'. MoE with MTP (multi-token prediction) draft layers; weights spill to system RAM. MTP draft layers enabled."
 }
}