{
 "schema_version": "1.0",
 "benchmark_id": "PS-0007",
 "hardware_ref": "gpu-box-01",
 "protocol": "reasoning-v1",
 "model": {
  "model_name": "LFM2.5-2.6B",
  "model_family": "LiquidFM (Liquid AI)",
  "parameter_count": 2600000000.0,
  "active_parameter_count": 2600000000.0,
  "quantization": null,
  "quantization_format": "GGUF",
  "model_file_size_gb": null
 },
 "hardware": {
  "gpu_name": "NVIDIA GeForce RTX 3060",
  "gpu_vendor": "NVIDIA",
  "gpu_architecture": "Ampere",
  "gpu_vram_gb": 12,
  "gpu_count": 2,
  "cpu_name": "Intel Xeon E5-1650 v4",
  "cpu_cores": 6,
  "cpu_threads": 12,
  "system_ram_gb": 128,
  "system_ram_speed_mhz": null,
  "storage_type": "NVMe SSD",
  "operating_system": "Ubuntu 26.04 LTS"
 },
 "software": {
  "inference_backend": "Ollama",
  "backend_version": "0.32.8",
  "runtime": "CUDA",
  "driver_version": "610.43.02"
 },
 "configuration": {
  "context_size": null,
  "offloading_strategy": "multi-gpu-spill"
 },
 "performance": {
  "generation_tokens_per_second": 67.11,
  "generation_tps_mean": 68.13,
  "generation_tps_max": 87.86,
  "time_to_first_token_seconds": null,
  "total_generated_tokens": 7201,
  "total_runtime_seconds": 87.7
 },
 "tests": {
  "attempted": 11,
  "completed": 11
 },
 "ps_points": 721.1,
 "result_classification": "excellent",
 "reproducibility": {
  "timestamp": "2026-08-09T18:09:06Z",
  "operator": "peasant-smith",
  "notes": "Optimized sampling params (temp 0.1)."
 }
}
