{
 "schema_version": "1.0",
 "benchmark_id": "PS-0003",
 "hardware_ref": "gpu-box-01",
 "protocol": "reasoning-v1",
 "model": {
  "model_name": "Laguna-S-2.1",
  "model_family": "Laguna (InclusionAI)",
  "parameter_count": 2100000000.0,
  "active_parameter_count": 2100000000.0,
  "quantization": null,
  "quantization_format": "GGUF",
  "model_file_size_gb": null
 },
 "hardware": {
  "gpu_name": "NVIDIA GeForce RTX 3060",
  "gpu_vendor": "NVIDIA",
  "gpu_architecture": "Ampere",
  "gpu_vram_gb": 12,
  "gpu_count": 2,
  "cpu_name": "Intel Xeon E5-1650 v4",
  "cpu_cores": 6,
  "cpu_threads": 12,
  "system_ram_gb": 128,
  "system_ram_speed_mhz": null,
  "storage_type": "NVMe SSD",
  "operating_system": "Ubuntu 26.04 LTS"
 },
 "software": {
  "inference_backend": "Ollama",
  "backend_version": "0.32.8",
  "runtime": "CUDA",
  "driver_version": "610.43.02"
 },
 "configuration": {
  "context_size": null,
  "offloading_strategy": "multi-gpu-spill"
 },
 "performance": {
  "generation_tokens_per_second": 4.99,
  "generation_tps_mean": 5.11,
  "generation_tps_max": 11.4,
  "time_to_first_token_seconds": null,
  "total_generated_tokens": 3140,
  "total_runtime_seconds": 305.5
 },
 "tests": {
  "attempted": 11,
  "completed": 11
 },
 "ps_points": 99.9,
 "result_classification": "usable",
 "reproducibility": {
  "timestamp": "2026-08-09T16:41:43Z",
  "operator": "peasant-smith",
  "notes": "Parameter count inferred from model name (S-2.1)."
 }
}
